6.Employee Database an Enterprise wishes to maintain a database to automate its operations. Enterprise is divided into certain departments and each department consists of employees.  The        following two tables describes the automation schemas Dept (deptno, dname, loc) Emp (empno, ename, job, mgr, hiredate, sal, comm, deptno)
 1.Create Dept table: Dept (deptno, dname, loc)
 2.Create Dept table: Emp (empno, ename, job, mgr, hiredate, sal, comm, deptno)
 3.Insert data int Dept and Emp tables
 4.Update the employee salary by 15%, whose experience is greater than 30 years
 5.Delete the employees, who completed 30 years of service.
 6.Display the manager who is having maximum number of employees working under him?
 7.Create a view, which contain employee names and their manager


mysql> show databases
    -> ;
+--------------------+
| Database           |
+--------------------+
| ashishsigdel       |
| chhimekee_dev      |
| dbmslab            |
| exam               |
| information_schema |
| kurakani           |
| mysql              |
| mysqldbms          |
| performance_schema |
| plantcare          |
| sendspace          |
| sys                |
| windor             |
+--------------------+
13 rows in set (0.00 sec)

mysql> use dbmslab;
Reading table information for completion of table and column names
You can turn off this feature to get a quicker startup with -A

Database changed
mysql> -- 1. Create Dept table
mysql> CREATE TABLE Dept (
    ->     deptno INT PRIMARY KEY,
    ->     dname VARCHAR(50),
    ->     loc VARCHAR(50)
    -> );
Query OK, 0 rows affected (0.02 sec)

mysql> -- 2. Create Emp table
mysql> CREATE TABLE Emp (
    ->     empno INT PRIMARY KEY,
    ->     ename VARCHAR(50),
    ->     job VARCHAR(50),
    ->     mgr INT,
    ->     hiredate DATE,
    ->     sal DECIMAL(10,2),
    ->     comm DECIMAL(10,2),
    ->     deptno INT,
    ->     FOREIGN KEY (deptno) REFERENCES Dept(deptno),
    ->     FOREIGN KEY (mgr) REFERENCES Emp(empno)
    -> );
ERROR 1050 (42S01): Table 'emp' already exists
mysql> -- 2. Create Emp table
mysql> CREATE TABLE Emp (
    ->     empno INT PRIMARY KEY,
    ->     ename VARCHAR(50),
    ->     job VARCHAR(50),
    ->     mgr INT,
    ->     hiredate DATE,
    ->     sal DECIMAL(10,2),
    ->     comm DECIMAL(10,2),
    ->     deptno INT,
    ->     FOREIGN KEY (deptno) REFERENCES Dept(deptno),
    ->     FOREIGN KEY (mgr) REFERENCES Emp(empno)
    -> );
Query OK, 0 rows affected (0.02 sec)

mysql> -- 3. Insert data into Dept and Emp tables
mysql> INSERT INTO Dept (deptno, dname, loc) VALUES 
    ->     (1, 'IT', 'Kathmandu'),
    ->     (2, 'HR', 'Lalitpur'),
    ->     (3, 'Finance', 'Pokhara');
Query OK, 3 rows affected (0.00 sec)
Records: 3  Duplicates: 0  Warnings: 0

mysql> INSERT INTO Emp (empno, ename, job, mgr, hiredate, sal, comm, deptno) VALUES
    ->     (101, 'Ram Shrestha', 'Manager', NULL, '1980-05-15', 50000, NULL, 1),
    ->     (102, 'Sita Koirala', 'Analyst', 101, '1995-08-20', 30000, 2000, 1),
    ->     (103, 'Hari Adhikari', 'Clerk', 101, '1988-03-10', 25000, NULL, 2),
    ->     (104, 'Gita Sharma', 'Executive', 102, '2005-07-25', 28000, 1500, 2),
    ->     (105, 'Bishal Thapa', 'Clerk', 101, '1985-11-30', 26000, NULL, 3);
Query OK, 5 rows affected (0.01 sec)
Records: 5  Duplicates: 0  Warnings: 0

mysql> -- 4. Update the salary by 15% for employees with experience greater than 30 years
mysql> UPDATE Emp 
    -> SET sal = sal * 1.15 
    -> WHERE hiredate <= DATE_SUB(CURRENT_DATE, INTERVAL 30 YEAR);
Query OK, 3 rows affected (0.01 sec)
Rows matched: 3  Changed: 3  Warnings: 0

mysql> -- 5. Delete the employees who have completed 30 years of service
mysql> DELETE FROM Emp 
    -> WHERE hiredate <= DATE_SUB(CURRENT_DATE, INTERVAL 30 YEAR);
ERROR 1451 (23000): Cannot delete or update a parent row: a foreign key constraint fails (`dbmslab`.`emp`, CONSTRAINT `emp_ibfk_2` FOREIGN KEY (`mgr`) REFERENCES `emp` (`empno`))

mysql> -- 6. Display the manager having the maximum number of employees working under him
mysql> SELECT mgr, COUNT(empno) AS number_of_employees
    -> FROM Emp
    -> WHERE mgr IS NOT NULL
    -> GROUP BY mgr
    -> ORDER BY number_of_employees DESC
    -> LIMIT 1;
+------+---------------------+
| mgr  | number_of_employees |
+------+---------------------+
|  101 |                   3 |
+------+---------------------+
1 row in set (0.00 sec)

mysql> -- 7. Create a view that contains employee names along with their manager names
mysql> CREATE VIEW EmpManager AS
    -> SELECT e.ename AS EmployeeName, m.ename AS ManagerName
    -> FROM Emp e
    -> LEFT JOIN Emp m ON e.mgr = m.empno;
Query OK, 0 rows affected (0.00 sec)