mysql> -- 1. Create the 'Client_Master' table
mysql> CREATE TABLE Client_Master (
    ->     ClientNO VARCHAR(10) PRIMARY KEY,
    ->     Name VARCHAR(100),
    ->     Address VARCHAR(255),
    ->     City VARCHAR(50),
    ->     State VARCHAR(50),
    ->     bal_due DECIMAL(10,2)
    -> );
Query OK, 0 rows affected (0.04 sec)

mysql> -- 2. Insert five records into 'Client_Master'
mysql> INSERT INTO Client_Master (ClientNO, Name, Address, City, State, bal_due) VALUES
    ->     ('C101', 'Rohan Gupta', '123 MG Road', 'Mumbai', 'Maharashtra', 4500.00),
    ->     ('C102', 'Sita Verma', '78 Park Avenue', 'Delhi', 'Delhi', 6200.00),
    ->     ('C103', 'Amit Sharma', '56 Raj Path', 'Kolkata', 'West Bengal', 7000.00),
    ->     ('C104', 'Pooja Mehta', '34 Gandhi Road', 'Bangalore', 'Karnataka', 3200.00),
    ->     ('C105', 'Vikram Rao', '90 Nehru Street', 'Chennai', 'Tamil Nadu', 5400.00);
Query OK, 5 rows affected (0.01 sec)
Records: 5  Duplicates: 0  Warnings: 0

mysql> -- 3. Display all records from 'Client_Master'
mysql> SELECT * FROM Client_Master;
+----------+-------------+-----------------+-----------+-------------+---------+
| ClientNO | Name        | Address         | City      | State       | bal_due |
+----------+-------------+-----------------+-----------+-------------+---------+
| C101     | Rohan Gupta | 123 MG Road     | Mumbai    | Maharashtra | 4500.00 |
| C102     | Sita Verma  | 78 Park Avenue  | Delhi     | Delhi       | 6200.00 |
| C103     | Amit Sharma | 56 Raj Path     | Kolkata   | West Bengal | 7000.00 |
| C104     | Pooja Mehta | 34 Gandhi Road  | Bangalore | Karnataka   | 3200.00 |
| C105     | Vikram Rao  | 90 Nehru Street | Chennai   | Tamil Nadu  | 5400.00 |
+----------+-------------+-----------------+-----------+-------------+---------+
5 rows in set (0.00 sec)

mysql> -- 4. Find the name of Clients whose balance_due > 5000
mysql> SELECT Name FROM Client_Master WHERE bal_due > 5000;
+-------------+
| Name        |
+-------------+
| Sita Verma  |
| Amit Sharma |
| Vikram Rao  |
+-------------+
3 rows in set (0.01 sec)

mysql> -- 5. Change the bal_due of ClientNO “C103” to Rs. 5100
mysql> UPDATE Client_Master SET bal_due = 5100 WHERE ClientNO = 'C103';
Query OK, 1 row affected (0.00 sec)
Rows matched: 1  Changed: 1  Warnings: 0

mysql> -- 6. Change the table name from 'Client_Master' to 'Client12'
mysql> RENAME TABLE Client_Master TO Client12;
Query OK, 0 rows affected (0.01 sec)

mysql> -- 7. Display the bal_due column with heading as “BALANCE”
mysql> SELECT ClientNO, Name, bal_due AS BALANCE FROM Client12;
+----------+-------------+---------+
| ClientNO | Name        | BALANCE |
+----------+-------------+---------+
| C101     | Rohan Gupta | 4500.00 |
| C102     | Sita Verma  | 6200.00 |
| C103     | Amit Sharma | 5100.00 |
| C104     | Pooja Mehta | 3200.00 |
| C105     | Vikram Rao  | 5400.00 |
+----------+-------------+---------+
5 rows in set (0.00 sec)